l aa r uu	l a r uu	e l aa r uu	e l ee i r uu	e l e j r uu	l ax r uu
n ee g oo d oo b oo r ax l	n ee g oo d uu b oo r ax l	n ee g oo d oo uu b oo r ax l	n ee g oo d o u b oo r ax l	n ee g oo d o uu b oo r ax l
n o r a e n p uu r ax	n oo r a e n p uu r ax	n oo r ax e n p uu r ax	n uu r a e n p uu r ax	n o r aa e n p uu r ax	n oo r aa e n p uu r ax	n o r a i n p uu r ax	n oo r a i n p uu r ax	n oo r ax i n p uu r ax	n uu r a i n p uu r ax	n o r aa i n p uu r ax	n oo r aa i n p uu r ax	n o r a e n p ax	n oo r a e n p ax	n oo r ax e n p ax	n uu r a e n p ax	n o r aa e n p ax	n oo r aa e n p ax	n o r a i n p ax	n oo r a i n p ax	n oo r ax i n p ax	n uu r a i n p ax	n o r aa i n p ax	n oo r aa i n p ax	n o r a e n p axr	n oo r a e n p axr	n oo r ax e n p axr	n uu r a e n p axr	n o r aa e n p axr	n oo r aa e n p axr	n o r a i n p axr	n oo r a i n p axr	n oo r ax i n p axr	n uu r a i n p axr	n o r aa i n p axr	n oo r aa i n p axr	n o r a e n p j u xr	n oo r a e n p j u xr	n oo r ax e n p j u xr	n uu r a e n p j u xr	n o r aa e n p j u xr	n oo r aa e n p j u xr	n o r a i n p j u xr	n oo r a i n p j u xr	n oo r ax i n p j u xr	n uu r a i n p j u xr	n o r aa i n p j u xr	n oo r aa i n p j u xr	n o r a e n p j u r	n oo r a e n p j u r	n oo r ax e n p j u r	n uu r a e n p j u r	n o r aa e n p j u r	n oo r aa e n p j u r	n o r a i n p j u r	n oo r a i n p j u r	n oo r ax i n p j u r	n uu r a i n p j u r	n o r aa i n p j u r	n oo r aa i n p j u r	n o r a e n p e xr	n oo r a e n p e xr	n oo r ax e n p e xr	n uu r a e n p e xr	n o r aa e n p e xr	n oo r aa e n p e xr	n o r a i n p e xr	n oo r a i n p e xr	n oo r ax i n p e xr	n uu r a i n p e xr	n o r aa i n p e xr	n oo r aa i n p e xr
p j oo t r m ii t ax s k aa
z ay p
s e b a s t j a n i n g r oo s oo	z e b a s t j a n i n g r oo s oo
z e xr g ay r a hx m aa n ii n o f
sh hh ii n ii hc a m ii
z ii g uu xr xr s
sh t e l aa n s k aa xr s g xr t
j a n ii
t s ii o n t ee	t s ii o n t ii
t s oo hh a r aa
n i n hh oo
a l m aa	aa l m ax	a l m ax
a z ii aa n k u ng f uu g ee n ax r a t s j oo n
k aa m ii l aa m e n d ax s	k aa m ii l aa m e n d e z
k a r o l i n hh j ax l t	k a r o l ii n ax hh j ax l t	k ax r ax l a i n hh j ax l t	k a r o l aa ii n hh j ax l t	k a r o l ay n hh j ax l t	k a r o l ii n hh j ax l t	k e xr ax l a i n hh j ax l t	k e r ax l a i n hh j ax l t	k a r ax l a i n hh j ax l t	k a r ax l aa ii n hh j ax l t	k a r ax l a ii n hh j ax l t	k a r ax l ay n hh j ax l t	k e r ax l aa ii n hh j ax l t	k e r ax l a ii n hh j ax l t	k e r ax l ay n hh j ax l t	k e xr ax l a ii n hh j ax l t	k e xr ax l ay n hh j ax l t	k a xr oo l ii n ax hh j ax l t	k aa xr oo l ii n ax hh j ax l t	k a r oo l ii n ax hh j ax l t
k a t s e t ax
k l aa u d j o a p b aa d oo	k l aw d j o a p b aa d oo
f e d ii l ee g r a n t	f e t l ee g r a n t	f e d ii l ax g r a n t	f e t l ax g r a n t	f e d ii l ee g r e n t	f e t l ee g r e n t	f e d ii l ax g r e n t	f e t l ax g r e n t	f e d ii l ee g r e n d	f e t l ee g r e n d	f e d ii l ax g r e n d	f e t l ax g r e n d	f e d ii l ee g xr e n t	f e t l ee g xr e n t	f e d ii l ax g xr e n t	f e t l ax g xr e n t	f e d ii l ee g r on	f e t l ee g r on	f e d ii l ax g r on	f e t l ax g r on	f e d ii l ee k r on	f e t l ee k r on	f e d ii l ax k r on	f e t l ax k r on	f e d ii l ee g r an	f e t l ee g r an	f e d ii l ax g r an	f e t l ax g r an
g a b r i e l f aw r	g aa b r i ax l f aw r	g aa b r i e l f aw r	g aa b r i ee l f aw r	g aa b r j ee l f aw r	g e i b r i ax l f aw r	g aa b r ii e l f aw r	g a b r ii e l f aw r	g a b r ii l f aw r	g a b xr ii e l f aw r	g e b r ii l f aw r	g e b xr ii l f aw r	g ee ii b r ii ax l f aw r	g ee ii b xr ii ax l f aw r	g e i b r ii ax l f aw r	g e i b xr ii ax l f aw r	g e ii b r ii ax l f aw r	g e ii b xr ii ax l f aw r	g e j b r ii ax l f aw r	g e j b xr ii ax l f aw r
hh ue u n aa
k e n s hh ii uue oo n ax t s uu
k u k aa
l ee m i t r ax
l oo m ii m ii eeu oy k s
l uu t s ii a n oo p a v a r o ii
m a t r ax g i m s
m uu z aa m a r oo uu f ii
e m t ee f uu j ii t ii v ax
o l ii v j aa f oo aa ay	o u l i v i ax f oo aa ay	oo uu l i v ii ax f oo aa ay	o uu l i v ii ax f oo aa ay	oo uu l ii v ii ax f oo aa ay	o uu l ii v ii ax f oo aa ay	o u l ii v ii ax f oo aa ay	o u l i v ii ax f oo aa ay
f u m v i f uu r ii t
r oe ue k s o p p
z ii g xr uu xr
t e j a ng
a t s ii t s a n z aa r i	a z ii z a n z aa r i	a s ii z a n z aa r i	ax z ii s a n z aa r i	ax s i s a n z aa r i	ax z i s a n z aa r i	a z ii s a n z aa r i
e r aa i s t r e f ii
ee r o s r a m a t s o ii
f u s oo u
zh aa k o m o p u k t s ii n ii	d zh ii a k oo m oo p u k t s ii n ii	zh ii a k o m oo p u k t s ii n ii	d zh ii a k o m oo p u k t s ii n ii
zh o u hh i s a ii s ii	d zh oo hh i s a ii s ii	d zh oo ii hh i s a ii s ii	zh oo uu hh i s a ii s ii	d zh oo uu hh i s a ii s ii	zh o uu hh i s a ii s ii	d zh o u hh i s a ii s ii	d zh o uu hh i s a ii s ii	t sh oo u hh i s a ii s ii	d zh oo u hh i s a ii s ii	t sh o u hh i s a ii s ii
l a t ii u m
l ee e n l aa r ee g uu ii
m a r t sh i n p xr t s uue b uue l oo v i k t s	m a r t s i n p xr t s uue b uue l oo v i k t s	m a r t sh ii n p xr t s uue b uue l oo v i k t s	m aa s i n p xr t s uue b uue l oo v i k t s	m aa s ii n p xr t s uue b uue l oo v i k t s	m a xr t sh i n p xr t s uue b uue l oo v i k t s	m a xr d zh ii n p xr t s uue b uue l oo v i k t s
uu z ax
p r oo t oo j ax
r a f a e l z a d i k	r a f a ee l z a d i k
r uu d ax
z ax oy ng g r ii
z o f ii a z oo m aa j oo	z oo f ii a z oo m aa j oo	s oo f ii aa z oo m aa j oo	s o f ii a z oo m aa j oo	z oo f ii aa z oo m aa j oo
s t ii v a n ax l l oo	s t e f a n ax l l oo	s t i v a n ax l l oo	s t i f a n ax l l oo	s t ii f a n ax l l oo	s t e v a n ax l l oo
t ee k a f r o m l i ng t oo z ii t ax z ii g uu r ax	t ii k e j f r o m l i ng t oo z ii t ax z ii g uu r ax	t ee k a f e xr m l i ng t oo z ii t ax z ii g uu r ax	t ii k e j f e xr m l i ng t oo z ii t ax z ii g uu r ax	t ee k a f r aa m l i ng t oo z ii t ax z ii g uu r ax	t ii k e j f r aa m l i ng t oo z ii t ax z ii g uu r ax	t ee k a f r a m l i ng t oo z ii t ax z ii g uu r ax	t ii k e j f r a m l i ng t oo z ii t ax z ii g uu r ax	t ee k a f xr a m l i ng t oo z ii t ax z ii g uu r ax	t ii k e j f xr a m l i ng t oo z ii t ax z ii g uu r ax
t s ii b r aa i ng g uu t s uu
