b ee t ee e s	b ee t e e s	b ii t ii e s	b ii t ee e s
d zh o u d zh ii	zh o u zh ii
k uue g oo
a v ii t s i ii	a v ii t sh ii
t i e sh t oo
t oo v ax l oo
f xr d r i k k o p ii n	f r e d e r i k k o p ii n	f xr e d e r i k k o p ii n	f xr d r i k sh a p i n	f r e d e r i k sh a p i n	f xr e d e r i k sh a p i n	f xr d r i k t sh aa p i n	f r e d e r i k t sh aa p i n	f xr e d e r i k t sh aa p i n	f xr d r i k sh oo uu p a n	f r e d e r i k sh oo uu p a n	f xr e d e r i k sh oo uu p a n	f xr d r i k t sh o u p a n	f r e d e r i k t sh o u p a n	f xr e d e r i k t sh o u p a n	f xr d r i k sh oo uu p e n	f r e d e r i k sh oo uu p e n	f xr e d e r i k sh oo uu p e n	f xr d r i k t sh oo uu p a n	f r e d e r i k t sh oo uu p a n	f xr e d e r i k t sh oo uu p a n	f xr d r i k sh o u p a n	f r e d e r i k sh o u p a n	f xr e d e r i k sh o u p a n	f xr d r i k t sh o uu p a n	f r e d e r i k t sh o uu p a n	f xr e d e r i k t sh o uu p a n	f xr d r i k sh o u p e n	f r e d e r i k sh o u p e n	f xr e d e r i k sh o u p e n	f xr d r i k sh o uu p a n	f r e d e r i k sh o uu p a n	f xr e d e r i k sh o uu p a n	f xr d r i k sh o uu p e n	f r e d e r i k sh o uu p e n	f xr e d e r i k sh o uu p e n	f xr d r i k sh o p an	f r e d e r i k sh o p an	f xr e d e r i k sh o p an	f xr d r i k sh o p on	f r e d e r i k sh o p on	f xr e d e r i k sh o p on	f xr d r i k sh o p en	f r e d e r i k sh o p en	f xr e d e r i k sh o p en
v i k t oo r ii aa m o n t
e k s oo	e hx oo	e k s oo u	e k s o u
m
m aa t oo m aa
n oo t t
a xr m ii n f a n b u uu r ax n	aa m ii n f a n b u uu r ax n	a m ii n f a n b u uu r ax n	aa xr m ii n f a n b u uu r ax n	a xr m ii n v a n b u uu r ax n	aa m ii n v a n b u uu r ax n	a m ii n v a n b u uu r ax n	aa xr m ii n v a n b u uu r ax n	a xr m ii n v ax n b u uu r ax n	aa m ii n v ax n b u uu r ax n	a m ii n v ax n b u uu r ax n	aa xr m ii n v ax n b u uu r ax n	a xr m ii n v e n b u uu r ax n	aa m ii n v e n b u uu r ax n	a m ii n v e n b u uu r ax n	aa xr m ii n v e n b u uu r ax n	a xr m ii n f a n b uu r ax n	aa m ii n f a n b uu r ax n	a m ii n f a n b uu r ax n	aa xr m ii n f a n b uu r ax n	a xr m ii n v a n b uu r ax n	aa m ii n v a n b uu r ax n	a m ii n v a n b uu r ax n	aa xr m ii n v a n b uu r ax n	a xr m ii n v ax n b uu r ax n	aa m ii n v ax n b uu r ax n	a m ii n v ax n b uu r ax n	aa xr m ii n v ax n b uu r ax n	a xr m ii n v e n b uu r ax n	aa m ii n v e n b uu r ax n	a m ii n v e n b uu r ax n	aa xr m ii n v e n b uu r ax n
k l ii n ax d ii o n	s e l ii n d ii o n	z e l ii n d ii o n	z ee l ii n d ii o n	s ee l ii n d ii o n	k l ii n ax d aa ii ax n	s e l ii n d aa ii ax n	z e l ii n d aa ii ax n	z ee l ii n d aa ii ax n	s ee l ii n d aa ii ax n	k l ii n ax d a i ax n	s e l ii n d a i ax n	z e l ii n d a i ax n	z ee l ii n d a i ax n	s ee l ii n d a i ax n	k l ii n ax d a ii ax n	s e l ii n d a ii ax n	z e l ii n d a ii ax n	z ee l ii n d a ii ax n	s ee l ii n d a ii ax n	k l ii n ax d ay ax n	s e l ii n d ay ax n	z e l ii n d ay ax n	z ee l ii n d ay ax n	s ee l ii n d ay ax n	k l ii n ax d ii aa n	s e l ii n d ii aa n	z e l ii n d ii aa n	z ee l ii n d ii aa n	s ee l ii n d ii aa n	k l ii n ax d ii a n	s e l ii n d ii a n	z e l ii n d ii a n	z ee l ii n d ii a n	s ee l ii n d ii a n	k l ii n ax d ii oo n	s e l ii n d ii oo n	z e l ii n d ii oo n	z ee l ii n d ii oo n	s ee l ii n d ii oo n
l uu d oo v ii k oo ay n aw d ii
m a r t en j e n z ax n	m a r t i n j e n z ax n	m a r t j i n j e n z ax n	m a xr t i n j e n z ax n	m a xr t ii n j e n z ax n	m aa t i n j e n z ax n	m aa r t ii n j e n z ax n	m a r t ii n j e n z ax n	m aa r t i n j e n z ax n	m a r t en zh e n s ax n	m a r t i n zh e n s ax n	m a r t j i n zh e n s ax n	m a xr t i n zh e n s ax n	m a xr t ii n zh e n s ax n	m aa t i n zh e n s ax n	m aa r t ii n zh e n s ax n	m a r t ii n zh e n s ax n	m aa r t i n zh e n s ax n
z aa n hh oo l oo	s a n hh oo l oo	s ax n hh oo l oo	s e n hh oo l oo	z a n hh oo l oo
aw l ii ii k r a v a l j oo
b oy p a b l o	b oo ii p a b l o	b o i p a b l o	b o ii p a b l o	b oy p aa b l oo	b oo ii p aa b l oo	b o i p aa b l oo	b o ii p aa b l oo	b oy p a b l oo	b oo ii p a b l oo	b o i p a b l oo	b o ii p a b l oo
e f k a j o t
j s aa n
e m d r ay u n t a hx t s i hc	m d r ay u n t a hx t s i hc	m i d r ay u n t a hx t s i hc	e m d r ay u n a hx t s i hc	m d r ay u n a hx t s i hc	m i d r ay u n a hx t s i hc	e m d r ay n t a hx t s i hc	m d r ay n t a hx t s i hc	m i d r ay n t a hx t s i hc	e m d r ay ax n a hx t s i hc	m d r ay ax n a hx t s i hc	m i d r ay ax n a hx t s i hc	e m d r ay ax n t a hx t s i hc	m d r ay ax n t a hx t s i hc	m i d r ay ax n t a hx t s i hc	e m d r ay u n t a hx t s i k	m d r ay u n t a hx t s i k	m i d r ay u n t a hx t s i k	e m d r ay u n a hx t s i k	m d r ay u n a hx t s i k	m i d r ay u n a hx t s i k	e m d r ay n t a hx t s i k	m d r ay n t a hx t s i k	m i d r ay n t a hx t s i k	e m d r ay ax n a hx t s i k	m d r ay ax n a hx t s i k	m i d r ay ax n a hx t s i k	e m d r ay ax n t a hx t s i k	m d r ay ax n t a hx t s i k	m i d r ay ax n t a hx t s i k	e m d r ay u n t a hx t t s i hc	m d r ay u n t a hx t t s i hc	m i d r ay u n t a hx t t s i hc	e m d r ay u n a hx t t s i hc	m d r ay u n a hx t t s i hc	m i d r ay u n a hx t t s i hc	e m d r ay n t a hx t t s i hc	m d r ay n t a hx t t s i hc	m i d r ay n t a hx t t s i hc	e m d r ay ax n a hx t t s i hc	m d r ay ax n a hx t t s i hc	m i d r ay ax n a hx t t s i hc	e m d r ay ax n t a hx t t s i hc	m d r ay ax n t a hx t t s i hc	m i d r ay ax n t a hx t t s i hc	e m d r ay u n t a hx t t s i k	m d r ay u n t a hx t t s i k	m i d r ay u n t a hx t t s i k	e m d r ay u n a hx t t s i k	m d r ay u n a hx t t s i k	m i d r ay u n a hx t t s i k	e m d r ay n t a hx t t s i k	m d r ay n t a hx t t s i k	m i d r ay n t a hx t t s i k	e m d r ay ax n a hx t t s i k	m d r ay ax n a hx t t s i k	m i d r ay ax n a hx t t s i k	e m d r ay ax n t a hx t t s i k	m d r ay ax n t a hx t t s i k	m i d r ay ax n t a hx t t s i k
m i t s k ii
m o n sh t aa i k s	m o n sh t aa e k s
e n t s ee t ee ay n hh u n d axr t z ii b ax n u n t t s v a n t s i hc	e n t s ee t ee a ii n hh u n d axr t z ii b ax n u n t t s v a n t s i hc	e n t s ee t ee a j n hh u n d axr t z ii b ax n u n t t s v a n t s i hc	e n t s ee t ee a i n hh u n d axr t z ii b ax n u n t t s v a n t s i hc	e n t s ee t ee e j n hh u n d axr t z ii b ax n u n t t s v a n t s i hc	e n t s ee t ee ax i n hh u n d axr t z ii b ax n u n t t s v a n t s i hc	e n t s ee t ee n hh u n d axr t z ii b ax n u n t t s v a n t s i hc	e n t s ee t ee ay n u n d axr t z ii b ax n u n t t s v a n t s i hc	e n t s ee t ee a ii n u n d axr t z ii b ax n u n t t s v a n t s i hc	e n t s ee t ee a j n u n d axr t z ii b ax n u n t t s v a n t s i hc	e n t s ee t ee a i n u n d axr t z ii b ax n u n t t s v a n t s i hc	e n t s ee t ee e j n u n d axr t z ii b ax n u n t t s v a n t s i hc	e n t s ee t ee ax i n u n d axr t z ii b ax n u n t t s v a n t s i hc	e n t s ee t ee n u n d axr t z ii b ax n u n t t s v a n t s i hc	e n t s ee t ee ay n hh u n d axr z ii b ax n u n t t s v a n t s i hc	e n t s ee t ee a ii n hh u n d axr z ii b ax n u n t t s v a n t s i hc	e n t s ee t ee a j n hh u n d axr z ii b ax n u n t t s v a n t s i hc	e n t s ee t ee a i n hh u n d axr z ii b ax n u n t t s v a n t s i hc	e n t s ee t ee e j n hh u n d axr z ii b ax n u n t t s v a n t s i hc	e n t s ee t ee ax i n hh u n d axr z ii b ax n u n t t s v a n t s i hc	e n t s ee t ee n hh u n d axr z ii b ax n u n t t s v a n t s i hc	e n t s ee t ee ay n hh u n d axr t z ii b m u n t t s v a n t s i hc	e n t s ee t ee a ii n hh u n d axr t z ii b m u n t t s v a n t s i hc	e n t s ee t ee a j n hh u n d axr t z ii b m u n t t s v a n t s i hc	e n t s ee t ee a i n hh u n d axr t z ii b m u n t t s v a n t s i hc	e n t s ee t ee e j n hh u n d axr t z ii b m u n t t s v a n t s i hc	e n t s ee t ee ax i n hh u n d axr t z ii b m u n t t s v a n t s i hc	e n t s ee t ee n hh u n d axr t z ii b m u n t t s v a n t s i hc	e n t s ee t ee ay n u n d axr t z ii b m u n t t s v a n t s i hc	e n t s ee t ee a ii n u n d axr t z ii b m u n t t s v a n t s i hc	e n t s ee t ee a j n u n d axr t z ii b m u n t t s v a n t s i hc	e n t s ee t ee a i n u n d axr t z ii b m u n t t s v a n t s i hc	e n t s ee t ee e j n u n d axr t z ii b m u n t t s v a n t s i hc	e n t s ee t ee ax i n u n d axr t z ii b m u n t t s v a n t s i hc	e n t s ee t ee n u n d axr t z ii b m u n t t s v a n t s i hc	e n t s ee t ee ay n hh u n d axr z ii b m u n t t s v a n t s i hc	e n t s ee t ee a ii n hh u n d axr z ii b m u n t t s v a n t s i hc	e n t s ee t ee a j n hh u n d axr z ii b m u n t t s v a n t s i hc	e n t s ee t ee a i n hh u n d axr z ii b m u n t t s v a n t s i hc	e n t s ee t ee e j n hh u n d axr z ii b m u n t t s v a n t s i hc	e n t s ee t ee ax i n hh u n d axr z ii b m u n t t s v a n t s i hc	e n t s ee t ee n hh u n d axr z ii b m u n t t s v a n t s i hc	e n t s ee t ee ay n hh u n d axr t z ii m u n t t s v a n t s i hc	e n t s ee t ee a ii n hh u n d axr t z ii m u n t t s v a n t s i hc	e n t s ee t ee a j n hh u n d axr t z ii m u n t t s v a n t s i hc	e n t s ee t ee a i n hh u n d axr t z ii m u n t t s v a n t s i hc	e n t s ee t ee e j n hh u n d axr t z ii m u n t t s v a n t s i hc	e n t s ee t ee ax i n hh u n d axr t z ii m u n t t s v a n t s i hc	e n t s ee t ee n hh u n d axr t z ii m u n t t s v a n t s i hc	e n t s ee t ee ay n u n d axr t z ii m u n t t s v a n t s i hc	e n t s ee t ee a ii n u n d axr t z ii m u n t t s v a n t s i hc	e n t s ee t ee a j n u n d axr t z ii m u n t t s v a n t s i hc	e n t s ee t ee a i n u n d axr t z ii m u n t t s v a n t s i hc	e n t s ee t ee e j n u n d axr t z ii m u n t t s v a n t s i hc	e n t s ee t ee ax i n u n d axr t z ii m u n t t s v a n t s i hc	e n t s ee t ee n u n d axr t z ii m u n t t s v a n t s i hc	e n t s ee t ee ay n hh u n d axr z ii m u n t t s v a n t s i hc	e n t s ee t ee a ii n hh u n d axr z ii m u n t t s v a n t s i hc	e n t s ee t ee a j n hh u n d axr z ii m u n t t s v a n t s i hc	e n t s ee t ee a i n hh u n d axr z ii m u n t t s v a n t s i hc	e n t s ee t ee e j n hh u n d axr z ii m u n t t s v a n t s i hc	e n t s ee t ee ax i n hh u n d axr z ii m u n t t s v a n t s i hc	e n t s ee t ee n hh u n d axr z ii m u n t t s v a n t s i hc	e n t s ee t ee ay n hh u n d axr t s ii b m u n t t s v a n t s i hc	e n t s ee t ee a ii n hh u n d axr t s ii b m u n t t s v a n t s i hc	e n t s ee t ee a j n hh u n d axr t s ii b m u n t t s v a n t s i hc	e n t s ee t ee a i n hh u n d axr t s ii b m u n t t s v a n t s i hc	e n t s ee t ee e j n hh u n d axr t s ii b m u n t t s v a n t s i hc	e n t s ee t ee ax i n hh u n d axr t s ii b m u n t t s v a n t s i hc	e n t s ee t ee n hh u n d axr t s ii b m u n t t s v a n t s i hc	e n t s ee t ee ay n u n d axr t s ii b m u n t t s v a n t s i hc	e n t s ee t ee a ii n u n d axr t s ii b m u n t t s v a n t s i hc	e n t s ee t ee a j n u n d axr t s ii b m u n t t s v a n t s i hc	e n t s ee t ee a i n u n d axr t s ii b m u n t t s v a n t s i hc	e n t s ee t ee e j n u n d axr t s ii b m u n t t s v a n t s i hc	e n t s ee t ee ax i n u n d axr t s ii b m u n t t s v a n t s i hc	e n t s ee t ee n u n d axr t s ii b m u n t t s v a n t s i hc	e n t s ee t ee ay n hh u n d axr s ii b m u n t t s v a n t s i hc	e n t s ee t ee a ii n hh u n d axr s ii b m u n t t s v a n t s i hc	e n t s ee t ee a j n hh u n d axr s ii b m u n t t s v a n t s i hc	e n t s ee t ee a i n hh u n d axr s ii b m u n t t s v a n t s i hc	e n t s ee t ee e j n hh u n d axr s ii b m u n t t s v a n t s i hc	e n t s ee t ee ax i n hh u n d axr s ii b m u n t t s v a n t s i hc	e n t s ee t ee n hh u n d axr s ii b m u n t t s v a n t s i hc	e n t s ee t ee ay n hh u n d axr t s ii m u n t t s v a n t s i hc	e n t s ee t ee a ii n hh u n d axr t s ii m u n t t s v a n t s i hc	e n t s ee t ee a j n hh u n d axr t s ii m u n t t s v a n t s i hc	e n t s ee t ee a i n hh u n d axr t s ii m u n t t s v a n t s i hc	e n t s ee t ee e j n hh u n d axr t s ii m u n t t s v a n t s i hc	e n t s ee t ee ax i n hh u n d axr t s ii m u n t t s v a n t s i hc	e n t s ee t ee n hh u n d axr t s ii m u n t t s v a n t s i hc	e n t s ee t ee ay n u n d axr t s ii m u n t t s v a n t s i hc	e n t s ee t ee a ii n u n d axr t s ii m u n t t s v a n t s i hc	e n t s ee t ee a j n u n d axr t s ii m u n t t s v a n t s i hc	e n t s ee t ee a i n u n d axr t s ii m u n t t s v a n t s i hc	e n t s ee t ee e j n u n d axr t s ii m u n t t s v a n t s i hc	e n t s ee t ee ax i n u n d axr t s ii m u n t t s v a n t s i hc	e n t s ee t ee n u n d axr t s ii m u n t t s v a n t s i hc	e n t s ee t ee ay n hh u n d axr s ii m u n t t s v a n t s i hc	e n t s ee t ee a ii n hh u n d axr s ii m u n t t s v a n t s i hc
p r ii m axr d ii aa	p r ii m axr d ii a
z a n d r o k a v a t s t s aa
d aa v ii d oo
d ee o r oo
g oo t z ii b ax n	g a t z ii b ax n	g oo uu z ii b ax n	g ax t z ii b ax n	g aa t z ii b ax n	g oo t z ii b m	g a t z ii b m	g oo uu z ii b m	g ax t z ii b m	g aa t z ii b m	g oo t z ii m	g a t z ii m	g oo uu z ii m	g ax t z ii m	g aa t z ii m	g oo t s ii b m	g a t s ii b m	g oo uu s ii b m	g ax t s ii b m	g aa t s ii b m	g oo t s ii m	g a t s ii m	g oo uu s ii m	g ax t s ii m	g aa t s ii m	g oo t s i m	g a t s i m	g oo uu s i m	g ax t s i m	g aa t s i m	g oo t z i m	g a t z i m	g oo uu z i m	g ax t z i m	g aa t z i m
l oo n
m oo t ii
n e v v ax
n o v oo aa m oo xr	n o v oo aa m o xr
z a b a t oo n
v a l ee r j ax b r oo u s a xr t	v a l axr ii b r oo u s a xr t	v a l e r ii b r oo u s a xr t	v a l a r ii b r oo u s a xr t
a n d r e a b oo s e l ii	a n d r ee a b oo s e l ii	a n d r ee aa b oo s e l ii
a k s v e l i n g r oo s oo
f r a n t sh e s k a b a t i s t e l ii
g a l ii m a t ii a s
d zh ee k u	d zh ee j k u	d zh e j k u	d zh ay k u	zh e i k u	d zh ee ii k u	zh e j k u	d zh e i k u	zh ee ii k u	d zh e ii k u	zh e ii k u	t sh e j k u	t sh ee k u
k a s b oo
l ee a z a l oo ng aa	l ii z a l oo ng aa	l ee j a z a l oo ng aa	l i j a z a l oo ng aa
l ii k ax l ii
m a m a m oo oo
m ii k r oo t ee d ee hh aa
p uue o t xr i l j i hc t hx a ii k o f s k ii	p uue o t xr i l j i hc t sh ay k o f s k ii
sh hh ue m a r t en	sh ay m a r t en	sh hh ue m a r t i n	sh ay m a r t i n	sh hh ue m a r t j i n	sh ay m a r t j i n	sh hh ue m a xr t i n	sh ay m a xr t i n	sh hh ue m a xr t ii n	sh ay m a xr t ii n	sh hh ue m aa t i n	sh ay m aa t i n	sh hh ue m aa r t ii n	sh ay m aa r t ii n	sh hh ue m a r t ii n	sh ay m a r t ii n	sh hh ue m aa r t i n	sh ay m aa r t i n
s v u m
t oo v ax sh t ue xr k ax
j ii r uu m aa
l a f uu xr aa xr n aa l t s
a l e k s an d r d e s p l aa t	a l e k s an d r e d e s p l aa t	a l e k s an d r ax d e s p l aa t
a n t o n j o v ii v aa l d ii	a n t oo n j o v ii v aa l d ii	ax n t o u n ii o u v ii v aa l d ii	ax n t o u n ii oo u v ii v aa l d ii
a r ii j ii t z i ng
d a ng g ax l oo
i uu
k r oo n oo
l oo 
n i ii g r i ii
s n oo aa l e g r aa
hh i k a r uu uu t aa d aa
t s v ay t sh e l oo s	t s v oo t sh e l oo s	t s v ay t sh e l o s	t s v oo t sh e l o s	t s v ay t sh ee l o s	t s v oo t sh ee l o s
a t ee t s
d aa xr j o m a r ii a n e l ii
d ii a n t v oo xr t	d i a n t v oo xr t	d ax a n t v oo xr t	d ii f a n t v oo xr t
e n ii oo m o r ii k oo n
ee r i k z a t ii	e r i k z a t ii	ee r i hc z a t ii
g aw l i n
m a r t en z o l f ay k	m a r t i n z o l f ay k	m a r t j i n z o l f ay k	m a xr t i n z o l f ay k	m a xr t ii n z o l f ay k	m aa t i n z o l f ay k	m aa r t ii n z o l f ay k	m a r t ii n z o l f ay k	m aa r t i n z o l f ay k	m a r t en z o u l f ax k	m a r t i n z o u l f ax k	m a r t j i n z o u l f ax k	m a xr t i n z o u l f ax k	m a xr t ii n z o u l f ax k	m aa t i n z o u l f ax k	m aa r t ii n z o u l f ax k	m a r t ii n z o u l f ax k	m aa r t i n z o u l f ax k
e n t s ee t ee
oo p ee t a ii aa f oo aa ay
t ee m i n
j uu n aa
b ax xr t oo l ax t
ee ee f ee
f uu j i t s uu
g ii g ii d a g o s t ii n oo
g oo j ii r aa
zh ii n m i hc ax l b l aa ay s	zh an m i hc ax l b l aa ay s	zh ee n m i hc ax l b l aa ay s	zh oo m i hc ax l b l aa ay s	d zh i n m i hc ax l b l aa ay s	d zh ii n m i hc ax l b l aa ay s	t sh oo n m i hc ax l b l aa ay s	d zh oo n m i hc ax l b l aa ay s	zh oo n m i hc ax l b l aa ay s	sh oo n m i hc ax l b l aa ay s	zh ii n m i hc l b l aa ay s	zh an m i hc l b l aa ay s	zh ee n m i hc l b l aa ay s	zh oo m i hc l b l aa ay s	d zh i n m i hc l b l aa ay s	d zh ii n m i hc l b l aa ay s	t sh oo n m i hc l b l aa ay s	d zh oo n m i hc l b l aa ay s	zh oo n m i hc l b l aa ay s	sh oo n m i hc l b l aa ay s	zh ii n m i sh e l b l aa ay s	zh an m i sh e l b l aa ay s	zh ee n m i sh e l b l aa ay s	zh oo m i sh e l b l aa ay s	d zh i n m i sh e l b l aa ay s	d zh ii n m i sh e l b l aa ay s	t sh oo n m i sh e l b l aa ay s	d zh oo n m i sh e l b l aa ay s	zh oo n m i sh e l b l aa ay s	sh oo n m i sh e l b l aa ay s
j hh a n j hh a n n s s oo n
n uu j aa b ax s
sh t r oo m e	s t r oo m ay	s t r oo m e
t aa n ii s hh k b a g k ii
k a z a n oo v aa
e k s i t
b ee e s d ee u	b ee e s d ee j uu	b ee e s d ee uu
a l oo k
k a m i j z ay n t z a n s	k a m i l z ay n t z a n s	k a m ii l z ay n t z a n s	k a m i j s e j n t z a n s	k a m i l s e j n t z a n s	k a m ii l s e j n t z a n s	k a m i j s a n z a n s	k a m i l s a n z a n s	k a m ii l s a n z a n s
f a b r i t s ii j oo p a t axr l ii n ii	f a b r i t s j oo p a t axr l ii n ii	f a b r ii t s ii j oo p a t axr l ii n ii
i n a v r o l t s ax n	ii n a v r o l t s ax n
l a ng l a ng	l aa ng l a ng	l ax ng l a ng	l e ng l a ng	l a ng l aa ng	l aa ng l aa ng	l ax ng l aa ng	l e ng l aa ng	l a ng l ax ng	l aa ng l ax ng	l ax ng l ax ng	l e ng l ax ng	l a ng l e ng	l aa ng l e ng	l ax ng l e ng	l e ng l e ng
m o r i s r aa v ax l	m o r ii s r aa v ax l	m oo r ii s r aa v ax l
m l aa n ii l aw r e n t	m l aa n ii l o r an	m l aa n ii l oo r an	m l aa n ii l o r ax n t	m l aa n ii l oo r
s oo f ii a k a xr l b e xr k	z oo f ii a k a xr l b e xr k	z o f ii aa k a xr l b e xr k	z oo f ii aa k a xr l b e xr k	s o f ii aa k a xr l b e xr k	z o f ii a k a xr l b e xr k
t hx aa m ii
j a n t ii xr z ax n	j aa n t ii xr z ax n	j a n t i r s ax n	j aa n t i r s ax n
a n t oo n n d f o xr k
b e n i b ax n a s ii	b e n ii b ax n a s ii	b ax n ii b ax n a s ii
p uu p ax n k hh aa t v aa
sh i k	t sh i k	sh ii k
k l a r a m e	k l aa r a m e	k l aa r ax m e	k l a r a m e ii	k l aa r a m e ii	k l aa r ax m e ii	k l a r a m e j	k l aa r a m e j	k l aa r ax m e j	k l a r a m a i	k l aa r a m a i	k l aa r ax m a i	k l a r a m a ii	k l aa r a m a ii	k l aa r ax m a ii	k l a r a m e i	k l aa r a m e i	k l aa r ax m e i	k l a r a m ay	k l aa r a m ay	k l aa r ax m ay	k l a r a m aa ii	k l aa r a m aa ii	k l aa r ax m aa ii	k l a r a m ee ii	k l aa r a m ee ii	k l aa r ax m ee ii
t s ee e l t s ee
d ii g oo r oo z ii b ax n hh u n d axr t n oy n u n t a hx t s i hc	d ii g oo r oo z ii b m hh u n d axr t n oy n u n t a hx t s i hc	d ii g oo r oo z ii m hh u n d axr t n oy n u n t a hx t s i hc	d ii g oo r oo s ii b m hh u n d axr t n oy n u n t a hx t s i hc	d ii g oo r oo s ii m hh u n d axr t n oy n u n t a hx t s i hc	d ii g oo r oo s i m hh u n d axr t n oy n u n t a hx t s i hc	d ii g oo r oo z i m hh u n d axr t n oy n u n t a hx t s i hc	d ii g oo r oo z ii b ax n u n d axr t n oy n u n t a hx t s i hc	d ii g oo r oo z ii b m u n d axr t n oy n u n t a hx t s i hc	d ii g oo r oo z ii m u n d axr t n oy n u n t a hx t s i hc	d ii g oo r oo s ii b m u n d axr t n oy n u n t a hx t s i hc	d ii g oo r oo s ii m u n d axr t n oy n u n t a hx t s i hc	d ii g oo r oo s i m u n d axr t n oy n u n t a hx t s i hc	d ii g oo r oo z i m u n d axr t n oy n u n t a hx t s i hc	d ii g oo r oo z ii b ax n hh u n d axr n oy n u n t a hx t s i hc	d ii g oo r oo z ii b m hh u n d axr n oy n u n t a hx t s i hc	d ii g oo r oo z ii m hh u n d axr n oy n u n t a hx t s i hc	d ii g oo r oo s ii b m hh u n d axr n oy n u n t a hx t s i hc	d ii g oo r oo s ii m hh u n d axr n oy n u n t a hx t s i hc	d ii g oo r oo s i m hh u n d axr n oy n u n t a hx t s i hc	d ii g oo r oo z i m hh u n d axr n oy n u n t a hx t s i hc	d ii g oo r oo z ii b ax n hh u n d axr t n oy n ax u n t a hx t s i hc	d ii g oo r oo z ii b m hh u n d axr t n oy n ax u n t a hx t s i hc	d ii g oo r oo z ii m hh u n d axr t n oy n ax u n t a hx t s i hc	d ii g oo r oo s ii b m hh u n d axr t n oy n ax u n t a hx t s i hc	d ii g oo r oo s ii m hh u n d axr t n oy n ax u n t a hx t s i hc	d ii g oo r oo s i m hh u n d axr t n oy n ax u n t a hx t s i hc	d ii g oo r oo z i m hh u n d axr t n oy n ax u n t a hx t s i hc	d ii g oo r oo z ii b ax n u n d axr t n oy n ax u n t a hx t s i hc	d ii g oo r oo z ii b m u n d axr t n oy n ax u n t a hx t s i hc	d ii g oo r oo z ii m u n d axr t n oy n ax u n t a hx t s i hc	d ii g oo r oo s ii b m u n d axr t n oy n ax u n t a hx t s i hc	d ii g oo r oo s ii m u n d axr t n oy n ax u n t a hx t s i hc	d ii g oo r oo s i m u n d axr t n oy n ax u n t a hx t s i hc	d ii g oo r oo z i m u n d axr t n oy n ax u n t a hx t s i hc	d ii g oo r oo z ii b ax n hh u n d axr n oy n ax u n t a hx t s i hc	d ii g oo r oo z ii b m hh u n d axr n oy n ax u n t a hx t s i hc	d ii g oo r oo z ii m hh u n d axr n oy n ax u n t a hx t s i hc	d ii g oo r oo s ii b m hh u n d axr n oy n ax u n t a hx t s i hc	d ii g oo r oo s ii m hh u n d axr n oy n ax u n t a hx t s i hc	d ii g oo r oo s i m hh u n d axr n oy n ax u n t a hx t s i hc	d ii g oo r oo z i m hh u n d axr n oy n ax u n t a hx t s i hc	d ii g oo r oo z ii b ax n hh u n d axr t n oy n u n a hx t s i hc	d ii g oo r oo z ii b m hh u n d axr t n oy n u n a hx t s i hc	d ii g oo r oo z ii m hh u n d axr t n oy n u n a hx t s i hc	d ii g oo r oo s ii b m hh u n d axr t n oy n u n a hx t s i hc	d ii g oo r oo s ii m hh u n d axr t n oy n u n a hx t s i hc	d ii g oo r oo s i m hh u n d axr t n oy n u n a hx t s i hc	d ii g oo r oo z i m hh u n d axr t n oy n u n a hx t s i hc	d ii g oo r oo z ii b ax n u n d axr t n oy n u n a hx t s i hc	d ii g oo r oo z ii b m u n d axr t n oy n u n a hx t s i hc	d ii g oo r oo z ii m u n d axr t n oy n u n a hx t s i hc	d ii g oo r oo s ii b m u n d axr t n oy n u n a hx t s i hc	d ii g oo r oo s ii m u n d axr t n oy n u n a hx t s i hc	d ii g oo r oo s i m u n d axr t n oy n u n a hx t s i hc	d ii g oo r oo z i m u n d axr t n oy n u n a hx t s i hc	d ii g oo r oo z ii b ax n hh u n d axr n oy n u n a hx t s i hc	d ii g oo r oo z ii b m hh u n d axr n oy n u n a hx t s i hc	d ii g oo r oo z ii m hh u n d axr n oy n u n a hx t s i hc	d ii g oo r oo s ii b m hh u n d axr n oy n u n a hx t s i hc	d ii g oo r oo s ii m hh u n d axr n oy n u n a hx t s i hc	d ii g oo r oo s i m hh u n d axr n oy n u n a hx t s i hc	d ii g oo r oo z i m hh u n d axr n oy n u n a hx t s i hc	d ii g oo r oo z ii b ax n hh u n d axr t n oy n ax u n a hx t s i hc	d ii g oo r oo z ii b m hh u n d axr t n oy n ax u n a hx t s i hc	d ii g oo r oo z ii m hh u n d axr t n oy n ax u n a hx t s i hc	d ii g oo r oo s ii b m hh u n d axr t n oy n ax u n a hx t s i hc	d ii g oo r oo s ii m hh u n d axr t n oy n ax u n a hx t s i hc	d ii g oo r oo s i m hh u n d axr t n oy n ax u n a hx t s i hc	d ii g oo r oo z i m hh u n d axr t n oy n ax u n a hx t s i hc	d ii g oo r oo z ii b ax n u n d axr t n oy n ax u n a hx t s i hc	d ii g oo r oo z ii b m u n d axr t n oy n ax u n a hx t s i hc	d ii g oo r oo z ii m u n d axr t n oy n ax u n a hx t s i hc	d ii g oo r oo s ii b m u n d axr t n oy n ax u n a hx t s i hc	d ii g oo r oo s ii m u n d axr t n oy n ax u n a hx t s i hc	d ii g oo r oo s i m u n d axr t n oy n ax u n a hx t s i hc	d ii g oo r oo z i m u n d axr t n oy n ax u n a hx t s i hc	d ii g oo r oo z ii b ax n hh u n d axr n oy n ax u n a hx t s i hc	d ii g oo r oo z ii b m hh u n d axr n oy n ax u n a hx t s i hc	d ii g oo r oo z ii m hh u n d axr n oy n ax u n a hx t s i hc	d ii g oo r oo s ii b m hh u n d axr n oy n ax u n a hx t s i hc	d ii g oo r oo s ii m hh u n d axr n oy n ax u n a hx t s i hc	d ii g oo r oo s i m hh u n d axr n oy n ax u n a hx t s i hc	d ii g oo r oo z i m hh u n d axr n oy n ax u n a hx t s i hc	d ii g oo r oo z ii b ax n hh u n d axr t n oy n n t a hx t s i hc	d ii g oo r oo z ii b m hh u n d axr t n oy n n t a hx t s i hc	d ii g oo r oo z ii m hh u n d axr t n oy n n t a hx t s i hc	d ii g oo r oo s ii b m hh u n d axr t n oy n n t a hx t s i hc	d ii g oo r oo s ii m hh u n d axr t n oy n n t a hx t s i hc	d ii g oo r oo s i m hh u n d axr t n oy n n t a hx t s i hc	d ii g oo r oo z i m hh u n d axr t n oy n n t a hx t s i hc	d ii g oo r oo z ii b ax n u n d axr t n oy n n t a hx t s i hc	d ii g oo r oo z ii b m u n d axr t n oy n n t a hx t s i hc	d ii g oo r oo z ii m u n d axr t n oy n n t a hx t s i hc	d ii g oo r oo s ii b m u n d axr t n oy n n t a hx t s i hc	d ii g oo r oo s ii m u n d axr t n oy n n t a hx t s i hc	d ii g oo r oo s i m u n d axr t n oy n n t a hx t s i hc	d ii g oo r oo z i m u n d axr t n oy n n t a hx t s i hc	d ii g oo r oo z ii b ax n hh u n d axr n oy n n t a hx t s i hc	d ii g oo r oo z ii b m hh u n d axr n oy n n t a hx t s i hc
d m i t r ii e f g r aa f oo f
e t f a xr t g r ii k
j o t j o t l i n	d zh ee d zh ee l i n	zh e j zh e j l i n
zh o u oo g i l b axr t oo	zh oo a o g i l b axr t oo	zh oo a oo g i l b axr t oo	zh o u oo d zh i l b e r t oo	zh oo a o d zh i l b e r t oo	zh oo a oo d zh i l b e r t oo	zh o u oo zh i l b e r t oo	zh oo a o zh i l b e r t oo	zh oo a oo zh i l b e r t oo	zh o u oo g i l b e xr t oo	zh oo a o g i l b e xr t oo	zh oo a oo g i l b e xr t oo	zh o u oo zh ii b e r t oo	zh oo a o zh ii b e r t oo	zh oo a oo zh ii b e r t oo
